{
  "version": 1,
  "$schema": "http://json-schema.org/draft-07/schema#",
  "type": "object",
  "required": [
    "version",
    "change",
    "codebase_commit",
    "verdict",
    "ran_at",
    "ran_by"
  ],
  "properties": {
    "version": {"const": 1},
    "change": {"type": "string", "minLength": 1},
    "codebase_commit": {"type": "string", "minLength": 7},
    "verdict": {
      "type": "array",
      "items": {
        "type": "object",
        "required": ["ac_id", "status", "confidence", "evidence", "reasoning"],
        "properties": {
          "ac_id": {"type": "string", "pattern": "^AC-[0-9]+$"},
          "status": {"enum": ["pass", "fail"]},
          "confidence": {"type": "number", "minimum": 0.0, "maximum": 1.0},
          "evidence": {"type": "array", "items": {"type": "string"}},
          "reasoning": {"type": "string"}
        }
      }
    },
    "ran_at": {"type": "string", "format": "date-time"},
    "ran_by": {"enum": ["rdd-verifier", "archive_gate_check"]}
  }
}