{
  "version": 1,
  "change": "test-change",
  "codebase_commit": "abc1234567",
  "verdict": [
    {
      "ac_id": "AC-1",
      "status": "fail",
      "confidence": 0.90,
      "evidence": [],
      "reasoning": "Function is missing from codebase"
    },
    {
      "ac_id": "AC-2",
      "status": "fail",
      "confidence": 0.95,
      "evidence": [],
      "reasoning": "Implementation is absent, no related code found"
    }
  ],
  "ran_at": "2026-08-26T00:00:00Z",
  "ran_by": "rdd-verifier"
}